{
  "plan_id": "cd275143",
  "title": "ML-based task outcome prediction and smart routing system with learning capabilities",
  "status": "approved",
  "created": "2025-07-30T04:04:10.737425+00:00",
  "template": null,
  "description": "ML-based task outcome prediction and smart routing system with learning capabilities",
  "requirements": {
    "functional": [
      "Implement ML-based task outcome prediction and smart routing system with learning capabilities functionality",
      "Maintain system consistency",
      "Ensure proper error handling"
    ],
    "non_functional": [
      "Performance: Response time < 2 seconds",
      "Reliability: 99.9% uptime",
      "Maintainability: Clear documentation"
    ],
    "constraints": [
      "Must follow existing architecture patterns",
      "Must be backward compatible",
      "Must include comprehensive tests"
    ]
  },
  "architecture": {
    "components": [
      {
        "name": "ml-based_task_outcome_prediction_and_smart_routing_system_with_learning_capabilities_module",
        "type": "service",
        "responsibilities": [
          "Handle ML-based task outcome prediction and smart routing system with learning capabilities operations"
        ]
      }
    ],
    "interfaces": [
      {
        "name": "ml-based_task_outcome_prediction_and_smart_routing_system_with_learning_capabilities_api",
        "type": "REST",
        "methods": [
          "GET",
          "POST",
          "PUT",
          "DELETE"
        ]
      }
    ],
    "data_flow": [
      "User request \u2192 API \u2192 Service \u2192 Data layer \u2192 Response"
    ],
    "patterns": [
      "Repository pattern for data access",
      "Service layer for business logic",
      "Factory pattern for object creation"
    ]
  },
  "dependencies": {
    "internal": [
      "todo_manager.py",
      "auto_sync_manager.py",
      "workflow_memory_intelligence_fixed.py"
    ],
    "external": [
      "Python 3.10+",
      "json (standard library)",
      "pathlib (standard library)"
    ],
    "optional": [
      "ollama (for LLM integration)",
      "sqlite3 (for database features)"
    ]
  },
  "risks": [
    {
      "risk": "Complexity creep",
      "probability": "medium",
      "impact": "high",
      "mitigation": "Use modular design and incremental development"
    },
    {
      "risk": "Integration issues",
      "probability": "low",
      "impact": "medium",
      "mitigation": "Comprehensive integration testing"
    }
  ],
  "implementation": {
    "phases": [
      {
        "phase": "Design",
        "duration": "2 days",
        "tasks": [
          "Create detailed design",
          "Review with team"
        ]
      },
      {
        "phase": "Implementation",
        "duration": "5 days",
        "tasks": [
          "Implement core functionality",
          "Add error handling",
          "Write tests"
        ]
      },
      {
        "phase": "Testing",
        "duration": "2 days",
        "tasks": [
          "Unit tests",
          "Integration tests",
          "Performance tests"
        ]
      },
      {
        "phase": "Documentation",
        "duration": "1 day",
        "tasks": [
          "Update documentation",
          "Create usage examples"
        ]
      }
    ],
    "estimated_total": "10 days"
  },
  "validation": {
    "checked": true,
    "checked_at": "2025-07-30T04:04:14.549269+00:00",
    "strict_mode": false,
    "issues": [],
    "warnings": [
      "Plan title should use lowercase with underscores"
    ]
  },
  "approval": {
    "approved": true,
    "approved_by": "architecture_mode_engine",
    "approved_at": "2025-07-30T04:04:18.289007+00:00"
  },
  "implementation_prompts": {
    "generated": true,
    "generated_at": "2025-07-30T04:04:22.631914+00:00",
    "output_directory": "/home/haymayndz/AI_System_Monorepo/memory-bank/architecture-plans/prompts/cd275143",
    "format": "markdown",
    "files": [
      "/home/haymayndz/AI_System_Monorepo/memory-bank/architecture-plans/prompts/cd275143/implementation_prompt.md",
      "/home/haymayndz/AI_System_Monorepo/memory-bank/architecture-plans/prompts/cd275143/testing_prompt.md",
      "/home/haymayndz/AI_System_Monorepo/memory-bank/architecture-plans/prompts/cd275143/documentation_prompt.md",
      "/home/haymayndz/AI_System_Monorepo/memory-bank/architecture-plans/prompts/cd275143/integration_prompt.md"
    ],
    "prompts": {
      "implementation": "# Implementation Prompt for: ML-based task outcome prediction and smart routing system with learning capabilities\n\n## Project Context\n### Project Overview\n# Project Context - AI System Monorepo\n\n## Project Overview\n\n**Project Name**: AI System Monorepo\n**Primary Goal**: Create a comprehensive, intelligent task management and memory system with CLI interface\n**Current Status**: Architecture Mode Implementation Phase\n\n## Scope and Vision\n\n### Primary Objectives\n1. **Intelligent Task Management**: Automated task decomposition, complexity analysis, and execution planning\n2. **Memory-Driven Development**: Persistent context and knowledge management across sessions\n3. **Architecture-First Workflow**: Plan-before-code approach with validation and approval steps\n4. **Aggressive Autonomy**: Self-optimizing, predictive, and proactive system behavior\n\n### Target Users\n- **Primary**: AI assistant developers and power users\n- **Secondary**: Development teams requiring structured task management\n- **Tertiary**: Automation engineers building intelligent workflows\n\n## Current System Capabilities\n\n### \u2705 Working Components\n- **CLI Interface**: Unified memory system CLI (`memory_system/cli.py`)\n- **Task Management**: Complete CRUD operations with JSON persistence\n- **Workflow Intelligence**: Smart task decomposition and complexity analysis\n- **State Synchronization**: Automatic sync across all state files\n- **Memory Integration**: Multiple memory systems (JSON, SQLite, Markdown)\n- **Health Monitoring**: System health checks and status reporting\n\n### \ud83d\udea7 In Development\n- **Architecture Mode**: Plan-first development workflow\n- **Project Brains**: Persistent knowledge maps and context management\n- **Predictive Features**: Task outcome prediction and optimization\n- **Advanced Autonomy**: Self-learning and adaptation capabilities\n\n## Technical Context\n\n### Core Technologies\n- **Language**: Python 3.10+\n- **Data Storage**: JSON files, SQLite database, Markdown documentation\n- **Architecture**: Modular CLI-based system with plugin architecture\n- **Memory Systems**: MCP (Model Context Protocol) integration\n- **AI Integration**: Ollama for LLM-based task processing\n\n### System Architecture Patterns\n- **Event-Driven**: State changes trigger automatic synchronization\n- **Plugin-Based**: Modular components with clear interfaces\n- **Memory-Persistent**: All context preserved across sessions\n- **CLI-Centric**: Command-line interface as primary interaction method\n\n## Business Rules and Constraints\n\n### Data Integrity Rules\n1. **Single Source of Truth**: `todo-tasks.json` is authoritative for all task data\n2. **Automatic Sync**: All state files must stay synchronized automatically\n3. **Backup Safety**: All changes must be backed up before modification\n4. **Graceful Degradation**: System must work even if optional components fail\n\n### Development Constraints\n1. **Architecture First**: No direct coding without approved architecture plan\n2. **Context Preservation**: All decisions and rationale must be documented\n3. **Testing Required**: All features must have health checks and validation\n4. **Backward Compatibility**: Changes must not break existing workflows\n\n## Success Metrics\n\n### Quantitative Metrics\n- **Task Processing Speed**: Average time from task creation to completion\n- **Error Rate**: Percentage of failed task executions\n- **Context Retention**: Accuracy of cross-session memory preservation\n- **Autonomy Level**: Percentage of tasks completed without human intervention\n\n### Qualitative Metrics\n- **Developer Experience**: Ease of use and productivity improvement\n- **System Reliability**: Consistency and predictability of behavior\n- **Knowledge Persistence**: Quality of long-term context retention\n- **Architectural Consistency**: Adherence to established patterns\n\n## Key Stakeholders\n\n### Primary Stakeholders\n- **System Architect**: Responsible for overall system design and evolution\n- **AI Assistant**: Primary user and beneficiary of the system\n- **Development Team**: Contributors to system enhancement and maintenance\n\n### Secondary Stakeholders\n- **End Users**: People using the AI assistant for task management\n- **System Administrators**: People maintaining and deploying the system\n\n## Project Boundaries\n\n### In Scope\n- Task management and workflow intelligence\n- Memory and context management\n- CLI interface and automation\n- Architecture-first development workflow\n- Integration with existing AI systems\n\n### Out of Scope\n- Graphical user interfaces (GUI)\n- Real-time collaboration features\n- External API integrations (beyond MCP)\n- Mobile applications\n- Enterprise authentication systems\n\n## Risk Factors\n\n### Technical Risks\n- **Complexity Creep**: System becoming too complex to maintain\n- **Performance Degradation**: Memory usage growing unbounded\n- **Integration Failures**: Problems with external dependencies\n- **Data Corruption**: Loss of task or context data\n\n### Mitigation Strategies\n- Regular complexity audits and refactoring\n- Automated cleanup and optimization processes\n- Graceful fallback mechanisms\n- Comprehensive backup and recovery systems\n\n## Evolution Strategy\n\n### Phase 1: Foundation (Completed)\n- Basic CLI system\n- Task management\n- State synchronization\n- Memory integration\n\n### Phase 2: Intelligence (Current)\n- Architecture Mode implementation\n- Project Brains development\n- Advanced workflow intelligence\n- Predictive capabilities\n\n### Phase 3: Autonomy (Future)\n- Self-optimization\n- Proactive task generation\n- Learning and adaptation\n- Advanced integration capabilities\n\n---\n\n*Last Updated: 2025-07-30*\n*Next Review: Weekly during active development*\n\n\n## Architecture Plan Details\n**Plan ID**: cd275143\n**Description**: ML-based task outcome prediction and smart routing system with learning capabilities\n**Status**: approved\n\n## Requirements\n### Functional\n- Implement ML-based task outcome prediction and smart routing system with learning capabilities functionality\n- Maintain system consistency\n- Ensure proper error handling\n### Non Functional\n- Performance: Response time < 2 seconds\n- Reliability: 99.9% uptime\n- Maintainability: Clear documentation\n### Constraints\n- Must follow existing architecture patterns\n- Must be backward compatible\n- Must include comprehensive tests\n\n\n## Architecture Design\n### Components\n- **ml-based_task_outcome_prediction_and_smart_routing_system_with_learning_capabilities_module**: service\n  - Handle ML-based task outcome prediction and smart routing system with learning capabilities operations\n### Interfaces\n- **ml-based_task_outcome_prediction_and_smart_routing_system_with_learning_capabilities_api**: REST\n### Data Flow\n- User request \u2192 API \u2192 Service \u2192 Data layer \u2192 Response\n### Patterns\n- Repository pattern for data access\n- Service layer for business logic\n- Factory pattern for object creation\n\n\n## Implementation Instructions\n\nYou are tasked with implementing the feature described in this plan. Follow these guidelines:\n\n### 1. File Structure\nCreate/modify the following files in `/home/haymayndz/AI_System_Monorepo/`:\n- `ml-based_task_outcome_prediction_and_smart_routing_system_with_learning_capabilities_module.py` - Main implementation\n- `test_ml-based_task_outcome_prediction_and_smart_routing_system_with_learning_capabilities.py` - Comprehensive tests\n- `memory-bank/project-brain/modules/ml-based_task_outcome_prediction_and_smart_routing_system_with_learning_capabilities.md` - Module documentation\n\n### 2. Implementation Steps\n#### Step 1: Design\n- Create detailed design\n- Review with team\n\n#### Step 2: Implementation\n- Implement core functionality\n- Add error handling\n- Write tests\n\n#### Step 3: Testing\n- Unit tests\n- Integration tests\n- Performance tests\n\n#### Step 4: Documentation\n- Update documentation\n- Create usage examples\n\n\n\n### 3. Code Patterns to Follow\n- Follow existing module structure\n- Use comprehensive error handling\n- Include proper logging\n- Add type hints\n- Use dataclasses for data structures\n- Follow PEP 8 style guidelines\n\n### 4. Dependencies and Imports\n### Internal\n- todo_manager.py\n- auto_sync_manager.py\n- workflow_memory_intelligence_fixed.py\n### External\n- Python 3.10+\n- json (standard library)\n- pathlib (standard library)\n### Optional\n- ollama (for LLM integration)\n- sqlite3 (for database features)\n\n\n### 5. Error Handling Requirements\n- Add comprehensive error handling with proper logging\n- Use try-except blocks for external dependencies\n- Provide meaningful error messages\n- Implement graceful degradation where possible\n\n### 6. Testing Requirements\n- Write unit tests for all new functions\n- Add integration tests for system interactions\n- Include edge case testing\n- Verify error handling paths\n\n### 7. Documentation Updates\n- Update relevant brain sections\n- Add docstrings for all new functions/classes\n- Update README if new features are user-facing\n- Create usage examples\n\n## Validation Checklist\n- [ ] All requirements implemented\n- [ ] Code follows established patterns\n- [ ] Error handling implemented\n- [ ] Tests written and passing\n- [ ] Documentation updated\n- [ ] Integration points working\n- [ ] No breaking changes to existing code\n\n## Ready to Execute\nThis prompt contains all necessary information to implement the planned feature. Copy and paste this entire prompt to your AI assistant for complete implementation.\n",
      "testing": "# Testing Prompt for: ML-based task outcome prediction and smart routing system with learning capabilities\n\n## Testing Requirements\n\nCreate comprehensive tests for the implemented feature: ML-based task outcome prediction and smart routing system with learning capabilities\n\n### Test Files to Create\n- `test_ml-based_task_outcome_prediction_and_smart_routing_system_with_learning_capabilities.py`\n- Integration tests in appropriate test directories\n\n### Test Categories\n\n#### 1. Unit Tests\n- Test all individual functions\n- Test edge cases and boundary conditions\n- Test error handling paths\n- Test with valid and invalid inputs\n\n#### 2. Integration Tests\n- Test interactions with existing systems\n- Test CLI integration\n- Test state management\n- Test file operations\n\n#### 3. Performance Tests\n- Test with large datasets\n- Test concurrent operations\n- Test memory usage\n\n### Testing Patterns\n- Use pytest framework\n- Follow AAA pattern (Arrange, Act, Assert)\n- Use fixtures for common test data\n- Mock external dependencies\n- Test both success and failure paths\n\n### Test Implementation\nImplement all tests following the project's testing standards and patterns.\n",
      "documentation": "# Documentation Prompt for: ML-based task outcome prediction and smart routing system with learning capabilities\n\n## Documentation Updates Required\n\nUpdate documentation for the implemented feature: ML-based task outcome prediction and smart routing system with learning capabilities\n\n### Files to Update\n\n#### 1. Project Brain Sections\n- Update relevant brain sections with new functionality\n- Add architectural decisions to brain\n- Document integration points\n\n#### 2. Code Documentation\n- Add comprehensive docstrings\n- Update type hints\n- Add inline comments for complex logic\n\n#### 3. User Documentation\n- Update CLI help text\n- Create usage examples\n- Update README if user-facing\n\n#### 4. Technical Documentation\n- Update architecture diagrams\n- Document API changes\n- Update deployment guides if needed\n\n### Documentation Standards\n- Use Google-style docstrings\n- Include type hints\n- Provide usage examples\n- Document all parameters and return values\n- Keep documentation up to date with code changes\n\n### Implementation\nUpdate all documentation following the project's documentation standards.\n",
      "integration": "# Integration Prompt for: ML-based task outcome prediction and smart routing system with learning capabilities\n\n## Integration Requirements\n\nEnsure the implemented feature integrates properly with existing systems.\n\n### Integration Points\n- CLI command integration\n- State management system\n- Memory and brain systems\n- Telemetry and logging\n- Health monitoring\n- Task management system\n\n### Integration Testing\n- Test CLI integration\n- Test state management integration\n- Test memory system integration\n- Test telemetry integration\n\n### System Health\n- Verify health checks still pass\n- Ensure no breaking changes\n- Test backward compatibility\n\n### Integration Implementation\nImplement all integration requirements and verify system stability.\n"
    }
  }
}